<!â€”fichero4-4.dtd -->
<!ELEMENT equipo (fichaJugador+, a)>
<!ELEMENT fichaJugador (nombre, apellido, posicion, nacionalidad?)>
<!ELEMENT nombre (#PCDATA)>
<!ATTLIST nombre sexo (masculino|femenino) #REQUIRED>
<!ATTLIST nombre edad  CDATA  #IMPLIED>
<!ATTLIST nombre estatura  CDATA  #IMPLIED>
<!ATTLIST nombre peso  CDATA  #REQUIRED>
<!ELEMENT apellido (#PCDATA)>
<!ELEMENT posicion (#PCDATA)>
<!ELEMENT nacionalidad (#PCDATA)>
<!ATTLIST a xmlns CDATA #IMPLIED>
<!ATTLIST a href CDATA #IMPLIED>
<!ATTLIST a class CDATA #IMPLIED>	
